"kodukaz","nazev","mj",platiod,platido,"okruh","zdroj","verifikace_csu","metodika" 
"141433","Hřbitov; urnový háj","ha",2006,9999,"14","ČÚZK","","Hřbitov, urnový háj"
"141434","Kulturní a osvětová plocha","ha",2006,9999,"14","ČÚZK","","Botanická a zoologická zahrada, skanzen, amfiteátr, památník apod."
"141441","Manipulační plocha","ha",2006,9999,"14","ČÚZK","","Manipulační a skladová plocha [§ 4 odst. 4 písm. d)]."
"141442","Dobývací prostor","ha",2006,9999,"14","ČÚZK","","Prostor jednoho nebo více výhradních ložisek nebo prostor jen části výhradního ložiska."
"141443","Skládka","ha",2006,9999,"14","ČÚZK","","Skládka odpadu."
"141450","Jiná plocha","ha",2006,9999,"14","ČÚZK","","Pozemek nevyužívaný žádným z ostatních vyjmenovaných způsobů včetně pozemku, na kterém je postavena stavba, která se v katastru neeviduje."
"141460","Neplodná půda","ha",2006,9999,"14","ČÚZK","","Svah, skála a jiná neplodná půda."
"141490","Neurčeno","ha",2006,9999,"14","ČÚZK","","Jedná se o plochy, jejichž využití není určeno."
"142000","Koeficient ekologické stability","index",2006,9999,"14","ČÚZK, výpočet ČSÚ","","Koeficient ekologické stability je poměrové číslo, které představuje poměr ploch tzv. stabilních a nestabilních krajinotvorných prvků v daném území. Mezi stabilní prvky patří lesní plochy, trvalé travní porosty, sady, zahrady, vinice, chmelnice a vodní plochy. Mezi nestabilní prvky patří orná půda, zastavěné plochy (vč. nádvoří) a ostatní plochy."
"150139","Azylové domy","počet",2005,9999,"15","MPSV ČR","ano","Azylové domy poskytují pobytové služby na přechodnou dobu osobám v nepříznivé sociální situaci spojené se ztrátou bydlení. Služba se poskytuje za úhradu."
"150140","Počet míst v azylových domech","počet",2005,9999,"15","MPSV ČR","ano","Azylové domy poskytují pobytové služby na přechodnou dobu osobám v nepříznivé sociální situaci spojené se ztrátou bydlení. Služba se poskytuje za úhradu."
"150141","Domy na půl cesty","počet",2005,9999,"15","MPSV ČR","ano","Domy na půl cesty poskytují pobytové služby zpravidla pro osoby do 26 let věku, které po dosažení zletilosti opouštějí školská zařízení pro výkon ústavní nebo ochranné výchovy, popřípadě pro osoby z jiných zařízení pro péči o děti a mládež, a pro osoby, které jsou propuštěny z výkonu trestu odnětí svobody nebo ochranné léčby. Služba se poskytuje za úhradu."
"150142","Počet míst v domech na půl cesty","počet",2005,9999,"15","MPSV ČR","ano","Domy na půl cesty poskytují pobytové služby zpravidla pro osoby do 26 let věku, které po dosažení zletilosti opouštějí školská zařízení pro výkon ústavní nebo ochranné výchovy, popřípadě pro osoby z jiných zařízení pro péči o děti a mládež, a pro osoby, které jsou propuštěny z výkonu trestu odnětí svobody nebo ochranné léčby. Služba se poskytuje za úhradu."
"150143","Noclehárny","počet",2005,9999,"15","MPSV ČR","ano","Noclehárny poskytují ambulantní služby osobám bez přístřeší, které mají zájem o využití hygienického zařízení a přenocování. Služba se poskytuje za úhradu ve výši stanovené poskytovatelem."
"150144","Počet míst v noclehárnách","počet",2005,9999,"15","MPSV ČR","ano","Noclehárny poskytují ambulantní služby osobám bez přístřeší, které mají zájem o využití hygienického zařízení a přenocování. Služba se poskytuje za úhradu ve výši stanovené poskytovatelem."
"150151","Centra denních služeb","počet",2007,9999,"15","MPSV ČR","ano","Centra denních služeb poskytují ambulantní služby osobám se sníženou soběstačností z důvodu věku, chronického onemocnění nebo zdravotního postižení, jejichž situace vyžaduje pomoc jiné fyzické osoby. Služba se poskytuje za úhradu."
"150152","Počet míst v centrech denních služeb","počet",2007,9999,"15","MPSV ČR","ano","Centra denních služeb poskytují ambulantní služby osobám se sníženou soběstačností z důvodu věku, chronického onemocnění nebo zdravotního postižení, jejichž situace vyžaduje pomoc jiné fyzické osoby. Služba se poskytuje za úhradu."
"150153","Denní stacionáře","počet",2007,9999,"15","MPSV ČR","ano","Denní stacionáře poskytují ambulantní služby osobám, které mají sníženou soběstačnost z důvodu věku, chronického onemocnění nebo zdravotního postižení, jejichž situace vyžaduje pravidelnou pomoc jiné fyzické osoby. Služba se poskytuje za úhradu."
"150154","Počet míst v denních stacionářích","počet",2007,9999,"15","MPSV ČR","ano","Denní stacionáře poskytují ambulantní služby osobám, které mají sníženou soběstačnost z důvodu věku, chronického onemocnění nebo zdravotního postižení, jejichž situace vyžaduje pravidelnou pomoc jiné fyzické osoby. Služba se poskytuje za úhradu."
"150155","Týdenní stacionáře","počet",2007,9999,"15","MPSV ČR","ano","Týdenní stacionáře poskytují pobytové služby osobám, které mají sníženou soběstačnost z důvodu věku, chronického onemocnění nebo zdravotního postižení, jejichž situace vyžaduje pravidelnou pomoc jiné fyzické osoby. Služba se poskytuje za úhradu."
"150156","Počet míst v týdenních stacionářích","počet",2007,9999,"15","MPSV ČR","ano","Týdenní stacionáře poskytují pobytové služby osobám, které mají sníženou soběstačnost z důvodu věku, chronického onemocnění nebo zdravotního postižení, jejichž situace vyžaduje pravidelnou pomoc jiné fyzické osoby. Služba se poskytuje za úhradu."
"150157","Domovy pro osoby se zdravotním postižením","počet",2007,9999,"15","MPSV ČR","ano","Domovy pro osoby se zdravotním postižením poskytují dlouhodobé pobytové služby osobám, které mají sníženou soběstačnost z důvodu zdravotního postižení, jejichž situace vyžaduje pravidelnou pomoc jiné osoby. Služba se poskytuje za úhradu"
"150158","Počet míst v domovech pro osoby se zdravotním postižením","počet",2007,9999,"15","MPSV ČR","ano","Domovy pro osoby se zdravotním postižením poskytují dlouhodobé pobytové služby osobám, které mají sníženou soběstačnost z důvodu zdravotního postižení, jejichž situace vyžaduje pravidelnou pomoc jiné osoby. Služba se poskytuje za úhradu"
"150159","Domovy pro seniory","počet",2007,9999,"15","MPSV ČR","ano","Domovy pro seniory poskytují dlouhodobé pobytové služby osobám, které mají sníženou soběstačnost zejména z důvodu věku, jejichž situace vyžaduje pravidelnou pomoc jiné osoby. Služba se poskytuje za úhradu."
"150160","Počet míst v domovech pro seniory","počet",2007,9999,"15","MPSV ČR","ano","Domovy pro seniory poskytují dlouhodobé pobytové služby osobám, které mají sníženou soběstačnost zejména z důvodu věku, jejichž situace vyžaduje pravidelnou pomoc jiné osoby. Služba se poskytuje za úhradu."
"150161","Domovy se zvláštním režimem","počet",2007,9999,"15","MPSV ČR","ano","Domovy se zvláštním režimem poskytují dlouhodobé pobytové služby osobám, které mají sníženou soběstačnost z důvodu chronického duševního onemocnění, závislosti na návykových látkách, osobám s Alzheimerovou nemocí, stařeckou demencí a dalšími typy demencí, jejichž situace vyžaduje pravidelnou pomoc jiné osoby. Služba se poskytuje za úhradu."
"150162","Počet míst v domovech se zvláštním určením","počet",2007,9999,"15","MPSV ČR","ano","Domovy se zvláštním režimem poskytují dlouhodobé pobytové služby osobám, které mají sníženou soběstačnost z důvodu chronického duševního onemocnění, závislosti na návykových látkách, osobám s Alzheimerovou nemocí, stařeckou demencí a dalšími typy demencí, jejichž situace vyžaduje pravidelnou pomoc jiné osoby. Služba se poskytuje za úhradu."
"150163","Chráněné bydlení","počet",2007,9999,"15","MPSV ČR","ano","Chráněné bydlení je pobytová služba poskytovaná osobám, které mají sníženou soběstačnost z důvodu zdravotního postižení nebo chronického onemocnění, včetně duševního onemocnění, jejichž situace vyžaduje pomoc jiné fyzické osoby. Chráněné bydlení má formu skupinového, popřípadě individuálního bydlení. Služba se poskytuje za úhradu."
"150164","Počet míst v chráněných bydleních","počet",2007,9999,"15","MPSV ČR","ano","Chráněné bydlení je pobytová služba poskytovaná osobám, které mají sníženou soběstačnost z důvodu zdravotního postižení nebo chronického onemocnění, včetně duševního onemocnění, jejichž situace vyžaduje pomoc jiné fyzické osoby. Chráněné bydlení má formu skupinového, popřípadě individuálního bydlení. Služba se poskytuje za úhradu."
"150165","Zařízení pro krizovou pomoc","počet",2007,9999,"15","MPSV ČR","ano","Zařízení pro krizovou pomoc je pobytová služba na přechodnou dobu poskytovaná osobám, které se nacházejí v situaci ohrožení zdraví nebo života, kdy přechodně nemohou řešit svoji nepříznivou situaci vlastními silami. Služba se poskytuje bez úhrady."
"150166","Počet míst v zařízení pro krizovou pomoc","počet",2007,9999,"15","MPSV ČR","ano","Zařízení pro krizovou pomoc je pobytová služba na přechodnou dobu poskytovaná osobám, které se nacházejí v situaci ohrožení zdraví nebo života, kdy přechodně nemohou řešit svoji nepříznivou situaci vlastními silami. Služba se poskytuje bez úhrady."
"150167","Nízkoprahová denní centra","počet",2007,9999,"15","MPSV ČR","ano","Nízkoprahová denní centra poskytují ambulantní služby, popřípadě terénní služby pro osoby bez přístřeší. V nízkoprahových denních centrech hradí osoby úhradu za stravu ve výši stanovené poskytovatelem."
"150169","Nízkoprahová zařízení pro děti a mládež","počet",2007,9999,"15","MPSV ČR","ano","Nízkoprahová denní centra poskytují ambulantní služby, popřípadě terénní služby pro osoby bez přístřeší. V nízkoprahových denních centrech hradí osoby úhradu za stravu ve výši stanovené poskytovatelem."
"150171","Terapeutické komunity","počet",2007,9999,"15","MPSV ČR","ano","Terapeutické komunity poskytují pobytové služby i na přechodnou dobu pro osoby závislé na návykových látkách nebo osoby s chronickým duševním onemocněním, které mají zájem o začlenění do běžného života. Služba se poskytuje za úhradu."
"150172","Počet míst v terepeutických komunitách","počet",2007,9999,"15","MPSV ČR","ano","Terapeutické komunity poskytují pobytové služby i na přechodnou dobu pro osoby závislé na návykových látkách nebo osoby s chronickým duševním onemocněním, které mají zájem o začlenění do běžného života. Služba se poskytuje za úhradu."
"150173","Sociální poradny","počet",2007,9999,"15","MPSV ČR","ano","Sociální poradny poskytují služby osobám v nepříznivé sociální situaci potřebné informace přispívající k řešení jejich situace. Zahrnují občanské poradny, manželské a rodinné poradny, sociální práci s osobami společensky nepřizpůsobenými, poradny pro oběti trestných činů a domácího násilí, sociálně právní poradenství pro osoby se zdravotním postižením a seniory. Služba se poskytuje bez úhrady."
"150175","Sociálně terapeutické dílny","počet",2007,9999,"15","MPSV ČR","ano","Sociálně terapeutické dílny jsou ambulantní služby poskytované osobám se sníženou soběstačností z důvodu zdravotního postižení, které nejsou z tohoto důvodu umístitelné na otevřeném ani chráněném trhu práce. Jejich účelem je dlouhodobá a pravidelná podpora zdokonalování pracovních návyků a dovedností prostřednictvím pracovní terapie. Služba se poskytuje za úhradu."
"150176","Počet míst v sociálně terapeutických dílnách","počet",2007,9999,"15","MPSV ČR","ano","Sociálně terapeutické dílny jsou ambulantní služby poskytované osobám se sníženou soběstačností z důvodu zdravotního postižení, které nejsou z tohoto důvodu umístitelné na otevřeném ani chráněném trhu práce. Jejich účelem je dlouhodobá a pravidelná podpora zdokonalování pracovních návyků a dovedností prostřednictvím pracovní terapie. Služba se poskytuje za úhradu."
"150177","Centra sociálně rehabilitačních služeb","počet",2007,9999,"15","MPSV ČR","ano","Centra sociálně rehabilitačních služeb poskytují rehabilitační služby, např. nácvik dovedností pro zvládání péče o vlastní osobu, soběstačnosti a dalších činností vedoucích k sociálnímu začlenění, zprostředkování kontaktu se společenským prostředím, výchovné, vzdělávací a aktivizační činnosti a pomoc při uplatňování práv a oprávněných zájmů. Služba se poskytuje za úhradu."
"150178","Počet míst v centrech sociálně rehabilitačních služeb","počet",2007,9999,"15","MPSV ČR","ano","Centra sociálně rehabilitačních služeb poskytují rehabilitační služby, např. nácvik dovedností pro zvládání péče o vlastní osobu, soběstačnosti a dalších činností vedoucích k sociálnímu začlenění, zprostředkování kontaktu se společenským prostředím, výchovné, vzdělávací a aktivizační činnosti a pomoc při uplatňování práv a oprávněných zájmů. Služba se poskytuje za úhradu."
"150179","Pracoviště rané péče","počet",2007,9999,"15","MPSV ČR","ano","Pracoviště rané péče poskytují služby dítěti a rodičům dítěte ve věku do 7 let, které je zdravotně postižené, nebo jehož vývoj je ohrožen v důsledku nepříznivého zdravotního stavu. Služba se poskytuje bez úhrady."
"150181","Intervenční centra","počet",2007,9999,"15","MPSV ČR","ano","Intervenční centra poskytují pomoc osobám ohroženým domácím násilím. Na základě zákonné povinnosti kontaktují osobu ohroženou, a to nejpozději do 48 hodin od doručení kopie úředního záznamu o vykázání ze společného obydlí. Součástí služby je zajištění spolupráce mezi poskytovateli jiných sociálních služeb, OSPOD, obcemi, útvary Policie ČR a obecní policie, jakož i ostatními orgány veřejné správy. Služba se poskytuje bez úhrady."
"150183","Služby následné péče","počet",2007,9999,"15","MPSV ČR","ano","Služby následné péče jsou ambulantní nebo pobytové služby poskytované osobám s chronickým duševním onemocněním a osobám závislým na návykových látkách, které absolvovaly ústavní léčbu ve zdravotnickém zařízení, absolvovaly ambulantní léčbu nebo se jí podrobují, nebo osobám, které abstinují. Služba se poskytuje bez úhrady."
"150184","Počet míst ve službách následné péče","počet",2007,9999,"15","MPSV ČR","ano","Služby následné péče jsou ambulantní nebo pobytové služby poskytované osobám s chronickým duševním onemocněním a osobám závislým na návykových látkách, které absolvovaly ústavní léčbu ve zdravotnickém zařízení, absolvovaly ambulantní léčbu nebo se jí podrobují, nebo osobám, které abstinují. Služba se poskytuje bez úhrady."
"160100","Počet podnikatelských subjektů celkem","počet",1993,9999,"16","ČSÚ","","Počet subjektů se sídlem na příslušném území, které jsou zapsány v Registru ekonomických subjektů (včetně subjektů v likvidaci)."
"160400","Počet subjektů bez zaměstnanců","počet",2004,9999,"16","ČSÚ","","Počet subjektů se sídlem na příslušném území, které jsou zapsány v Registru ekonomických subjektů (včetně subjektů v likvidaci). Subjekty jsou klasifikovány podle počtu zaměstnanců ve smyslu § 2, odst. 1, 2, 3 a 7 zákona č. 7/2002 Sb., o podpoře malého a středního podnikání"
"160410","Počet subjektů s 1-9 zaměstnanci - mikropodniky","počet",2004,9999,"16","ČSÚ","","Počet subjektů se sídlem na příslušném území, které jsou zapsány v Registru ekonomických subjektů (včetně subjektů v likvidaci). Subjekty jsou klasifikovány podle počtu zaměstnanců ve smyslu § 2, odst. 1, 2, 3 a 7 zákona č. 7/2002 Sb., o podpoře malého a středního podnikání"
"160420","Počet subjektů s 10-49 zaměstnanci - malé podniky","počet",2004,9999,"16","ČSÚ","","Počet subjektů se sídlem na příslušném území, které jsou zapsány v Registru ekonomických subjektů (včetně subjektů v likvidaci). Subjekty jsou klasifikovány podle počtu zaměstnanců ve smyslu § 2, odst. 1, 2, 3 a 7 zákona č. 7/2002 Sb., o podpoře malého a středního podnikání"
"160421","Počet subjektů s 10-19 zaměstnanci","počet",2010,9999,"16","ČSÚ","","Počet subjektů se sídlem na příslušném území, které jsou zapsány v Registru ekonomických subjektů (včetně subjektů v likvidaci). Subjekty jsou klasifikovány podle počtu zaměstnanců ve smyslu § 2, odst. 1, 2, 3 a 7 zákona č. 7/2002 Sb., o podpoře malého a středního podnikání"
"160422","Počet subjektů s 20-49 zaměstnanci","počet",2010,9999,"16","ČSÚ","","Počet subjektů se sídlem na příslušném území, které jsou zapsány v Registru ekonomických subjektů (včetně subjektů v likvidaci). Subjekty jsou klasifikovány podle počtu zaměstnanců ve smyslu § 2, odst. 1, 2, 3 a 7 zákona č. 7/2002 Sb., o podpoře malého a středního podnikání"
"160430","Počet subjektů s 50-249 zaměstnanci - střední podniky","počet",2004,9999,"16","ČSÚ","","Počet subjektů se sídlem na příslušném území, které jsou zapsány v Registru ekonomických subjektů (včetně subjektů v likvidaci). Subjekty jsou klasifikovány podle počtu zaměstnanců ve smyslu § 2, odst. 1, 2, 3 a 7 zákona č. 7/2002 Sb., o podpoře malého a středního podnikání"
"160431","Počet subjektů s 50-99 zaměstnanci","počet",2010,9999,"16","ČSÚ","","Počet subjektů se sídlem na příslušném území, které jsou zapsány v Registru ekonomických subjektů (včetně subjektů v likvidaci). Subjekty jsou klasifikovány podle počtu zaměstnanců (fyzických osob) uvedeného v aktuálním statistickém zjišťování"
"160432","Počet subjektů s 100-249 zaměstnanci","počet",2010,9999,"16","ČSÚ","","Počet subjektů se sídlem na příslušném území, které jsou zapsány v Registru ekonomických subjektů (včetně subjektů v likvidaci). Subjekty jsou klasifikovány podle počtu zaměstnanců (fyzických osob) uvedeného v aktuálním statistickém zjišťování"
"160440","Počet subjektů s více než 249 zaměstnanci - velké podniky","počet",2004,9999,"16","ČSÚ","","Počet subjektů se sídlem na příslušném území, které jsou zapsány v Registru ekonomických subjektů (včetně subjektů v likvidaci). Subjekty jsou klasifikovány podle počtu zaměstnanců (fyzických osob) uvedeného v aktuálním statistickém zjišťování"
"160441","Počet subjektů s 250-499 zaměstnanci","počet",2010,9999,"16","ČSÚ","","Počet subjektů se sídlem na příslušném území, které jsou zapsány v Registru ekonomických subjektů (včetně subjektů v likvidaci). Subjekty jsou klasifikovány podle počtu zaměstnanců (fyzických osob) uvedeného v aktuálním statistickém zjišťování"
"160442","Počet subjektů s 500-999 zaměstnanci","počet",2010,9999,"16","ČSÚ","","Počet subjektů se sídlem na příslušném území, které jsou zapsány v Registru ekonomických subjektů (včetně subjektů v likvidaci). Subjekty jsou klasifikovány podle počtu zaměstnanců (fyzických osob) uvedeného v aktuálním statistickém zjišťování"
"160443","Počet subjektů s 1000-2499 zaměstnanci","počet",2010,9999,"16","ČSÚ","","Počet subjektů se sídlem na příslušném území, které jsou zapsány v Registru ekonomických subjektů (včetně subjektů v likvidaci). Subjekty jsou klasifikovány podle počtu zaměstnanců (fyzických osob) uvedeného v aktuálním statistickém zjišťování"
"160444","Počet subjektů s 2500 a více  zaměstnanci","počet",2010,9999,"16","ČSÚ","","Počet subjektů se sídlem na příslušném území, které jsou zapsány v Registru ekonomických subjektů (včetně subjektů v likvidaci). Subjekty jsou klasifikovány podle počtu zaměstnanců (fyzických osob) uvedeného v aktuálním statistickém zjišťování"
"160450","Počet subjektů - nezjištěno","počet",2004,9999,"16","ČSÚ","","Počet subjektů se sídlem na příslušném území, které jsou zapsány v Registru ekonomických subjektů (včetně subjektů v likvidaci). Subjekty jsou klasifikovány podle počtu zaměstnanců (fyzických osob) uvedeného v aktuálním statistickém zjišťování"
"160500","A Zemědělství; lesnictví; rybářství","počet",2010,9999,"16","ČSÚ","","Počet subjektů se sídlem na příslušném území, které jsou zapsány v Registru ekonomických subjektů (včetně subjektů v likvidaci). Do odvětví podle klasifikace CZ-NACE jsou subjekty zařazeny podle své hlavní (převažující) činnosti."
"160510","B-E Průmysl celkem","počet",2010,9999,"16","ČSÚ","","Počet subjektů se sídlem na příslušném území, které jsou zapsány v Registru ekonomických subjektů (včetně subjektů v likvidaci). Do odvětví podle klasifikace CZ-NACE jsou subjekty zařazeny podle své hlavní (převažující) činnosti."
"160520","B Těžba a dobývání","počet",2010,9999,"16","ČSÚ","","Počet subjektů se sídlem na příslušném území, které jsou zapsány v Registru ekonomických subjektů (včetně subjektů v likvidaci). Do odvětví podle klasifikace CZ-NACE jsou subjekty zařazeny podle své hlavní (převažující) činnosti."
"160530","C Zpracovatelský průmysl","počet",2010,9999,"16","ČSÚ","","Počet subjektů se sídlem na příslušném území, které jsou zapsány v Registru ekonomických subjektů (včetně subjektů v likvidaci). Do odvětví podle klasifikace CZ-NACE jsou subjekty zařazeny podle své hlavní (převažující) činnosti."
"160540","D Výroba a rozvod elektřiny; plynu; tepla a klimatizovaného vzduchu","počet",2010,9999,"16","ČSÚ","","Počet subjektů se sídlem na příslušném území, které jsou zapsány v Registru ekonomických subjektů (včetně subjektů v likvidaci). Do odvětví podle klasifikace CZ-NACE jsou subjekty zařazeny podle své hlavní (převažující) činnosti."
"160550","E Zásobování vodou; činnosti související s odpadnými vodami; odpady a sanacemi","počet",2010,9999,"16","ČSÚ","","Počet subjektů se sídlem na příslušném území, které jsou zapsány v Registru ekonomických subjektů (včetně subjektů v likvidaci). Do odvětví podle klasifikace CZ-NACE jsou subjekty zařazeny podle své hlavní (převažující) činnosti."
"160560","F Stavebnictví","počet",2010,9999,"16","ČSÚ","","Počet subjektů se sídlem na příslušném území, které jsou zapsány v Registru ekonomických subjektů (včetně subjektů v likvidaci). Do odvětví podle klasifikace CZ-NACE jsou subjekty zařazeny podle své hlavní (převažující) činnosti."
"160570","G Velkoobchod a maloobchod; opravy a údržba motorových vozidel","počet",2010,9999,"16","ČSÚ","","Počet subjektů se sídlem na příslušném území, které jsou zapsány v Registru ekonomických subjektů (včetně subjektů v likvidaci). Do odvětví podle klasifikace CZ-NACE jsou subjekty zařazeny podle své hlavní (převažující) činnosti."
"160580","H Doprava a skladování","počet",2010,9999,"16","ČSÚ","","Počet subjektů se sídlem na příslušném území, které jsou zapsány v Registru ekonomických subjektů (včetně subjektů v likvidaci). Do odvětví podle klasifikace CZ-NACE jsou subjekty zařazeny podle své hlavní (převažující) činnosti."
"160590","I Ubytování; stravování a pohostinství","počet",2010,9999,"16","ČSÚ","","Počet subjektů se sídlem na příslušném území, které jsou zapsány v Registru ekonomických subjektů (včetně subjektů v likvidaci). Do odvětví podle klasifikace CZ-NACE jsou subjekty zařazeny podle své hlavní (převažující) činnosti."
"160600","J Informační a komunikační činnosti","počet",2010,9999,"16","ČSÚ","","Počet subjektů se sídlem na příslušném území, které jsou zapsány v Registru ekonomických subjektů (včetně subjektů v likvidaci). Do odvětví podle klasifikace CZ-NACE jsou subjekty zařazeny podle své hlavní (převažující) činnosti."
"160610","K Peněžnictví a pojišťovnictví","počet",2010,9999,"16","ČSÚ","","Počet subjektů se sídlem na příslušném území, které jsou zapsány v Registru ekonomických subjektů (včetně subjektů v likvidaci). Do odvětví podle klasifikace CZ-NACE jsou subjekty zařazeny podle své hlavní (převažující) činnosti."
"160620","L Činnosti v oblasti nemovitostí","počet",2010,9999,"16","ČSÚ","","Počet subjektů se sídlem na příslušném území, které jsou zapsány v Registru ekonomických subjektů (včetně subjektů v likvidaci). Do odvětví podle klasifikace CZ-NACE jsou subjekty zařazeny podle své hlavní (převažující) činnosti."
"160630","M Profesní; vědecké a technické činnosti","počet",2010,9999,"16","ČSÚ","","Počet subjektů se sídlem na příslušném území, které jsou zapsány v Registru ekonomických subjektů (včetně subjektů v likvidaci). Do odvětví podle klasifikace CZ-NACE jsou subjekty zařazeny podle své hlavní (převažující) činnosti."
